maintenance_id,bike_id,reported_time,resolved_time,issue_description
ca45b493-6be8-4f2b-b7df-87617e2a3fde,23a0e656-edc6-4dd6-939b-80f4d715c9cd,2025-08-07 23:47:38,2025-08-09,Broken
601fd578-b456-4389-8c54-ab3f5a44c3e7,78474814-e054-4ab5-af7f-8ce8e3e2ec31,2025-08-07 01:06:48,2025-08-10,"The handlebars on my rental bike are loose and keep shifting while I'm riding, it's pretty annoying. I've tried to tighten them but it doesn't seem to be making a difference. I'd appreciate it if someone could take a look and fix the issue so I can finish my ride safely."
09465a13-15bb-4095-9bee-55abf789199a,93d97605-47eb-4b98-94b4-08c7e156d2e8,2025-08-07 22:52:03,2025-08-09,"The brakes on my rental bike are not working properly, it's taking a lot of effort to slow down and stop. I'm having to squeeze the brake levers really hard to get any response, which is kinda scary. I'd appreciate it if someone could take a look and fix the issue ASAP."
2f8ac337-59e3-4ab3-8ba2-d63f40ea5dca,de21cf20-38ed-4023-a851-8644b6a318f2,2025-08-07 15:13:58,2025-08-10,"The handlebars on my rental bike are loose and keep shifting while I'm riding, it's pretty annoying. I've tried to tighten them but it doesn't seem to be making a difference. I'd appreciate it if someone could take a look and fix the issue so I can finish my ride safely."
0bedd9dc-0d5f-4f54-99ab-25aa60c2c144,41d0804c-4ad1-48a4-98ca-8c86c6534060,2025-08-07 07:49:38,2025-08-08,"The handlebars on my rental bike are loose and keep shifting while I'm riding, it's pretty annoying. I've tried to tighten them but it doesn't seem to be making a difference. I'd appreciate it if someone could take a look and fix the issue so I can finish my ride safely."
32a2b5ae-f130-434d-b8e7-006e0bbe2520,42b14aa0-5235-4653-96b0-9c2823cc2541,2025-08-07 15:49:44,2025-08-09,"The safety reflectors on my rental bike are loose and not securely attached, which is a safety concern. I noticed the issue as soon as I started riding and I'm worried it could cause problems, especially at night. I'd appreciate it if someone could take a look and fix the reflectors as soon as possible."
3527b491-7f69-43e3-9b4b-054c375fc800,e88d73d0-3858-425d-b878-37545e4c6a18,2025-08-07 19:54:59,2025-08-09,Broken
