maintenance_id,bike_id,reported_time,resolved_time,issue_description
fe100c6c-6bb5-4ab2-878f-d26f6fc4bc0e,f1c0f480-34de-459b-bd5b-6c957c8d92dd,2025-08-10 01:59:40,2025-08-15,"The safety reflectors on my rental bike are loose and not securely attached, which is a safety concern. I noticed the issue as soon as I started riding and I'm worried it could cause problems, especially at night. I'd appreciate it if someone could take a look and fix the reflectors as soon as possible."
a4769937-5036-4a34-8962-0c45b0dfa597,1f1514c4-e48a-47c1-bfd3-b2bfec408657,2025-08-10 07:14:00,2025-08-12,"The brakes on my rental bike are not working properly, it's taking a lot of effort to slow down and stop. I'm having to squeeze the brake levers really hard to get any response, which is kinda scary. I'd appreciate it if someone could take a look and fix the issue ASAP."
0c708a72-6ec3-4506-9fca-afde67433d06,bd5ef3bd-9063-47a4-bebd-32e10b9a69f6,2025-08-10 21:56:34,2025-08-11,"The brakes on my rental bike are not working properly, it's taking a lot of effort to slow down and stop. I'm having to squeeze the brake levers really hard to get any response, which is kinda scary. I'd appreciate it if someone could take a look and fix the issue ASAP."
dcb9f3f1-684e-4492-ad67-435f1c8a5b51,02f2d182-a1d2-4dd6-826d-6c64a887c36c,2025-08-10 11:55:42,2025-08-15,"The seat on my rental bike is loose and keeps sliding back and forth, making it hard to ride. I've tried to tighten it, but it doesn't seem to be staying in place. Can I get a replacement or have this one fixed ASAP?"
abf5e8bb-b82f-455b-a15e-626687aa396c,41d0804c-4ad1-48a4-98ca-8c86c6534060,2025-08-10 19:50:21,2025-08-12,"The brakes on my rental bike are not working properly, it's taking a lot of effort to slow down and stop. I'm having to squeeze the brake levers really hard to get any response, which is kinda scary. I'd appreciate it if someone could take a look and fix the issue ASAP."
8087ee74-9ebe-4f1c-972b-bb517eacdcff,76e8423a-2fd3-4219-b029-5a2c0f74e88e,2025-08-10 23:58:27,2025-08-14,"The tires on my rental bike are low on air and one of them has a slow leak, making it difficult to ride. I've only had the bike for an hour and I'm already having to stop frequently to add air. I'd appreciate it if someone could take a look at it and fix the issue as soon as possible."
3ed75a32-02cd-4884-a037-e67b943bff28,4b0aa821-01a4-4b8d-b182-2adc93652191,2025-08-10 23:36:50,2025-08-13,Broken
