maintenance_id,bike_id,reported_time,resolved_time,issue_description
9a2e2d40-3d6d-4be8-9cb2-3c4b7c1caa51,f1c0f480-34de-459b-bd5b-6c957c8d92dd,2025-07-15 18:38:22,2025-07-18,"The safety reflectors on my rental bike are loose and not securely attached, which is a safety concern. I noticed the issue as soon as I started riding and I'm worried it could cause problems, especially at night. I'd appreciate it if someone could take a look and fix the reflectors as soon as possible."
1ae124cb-a99e-4b5b-a5d4-3641e14dbb9c,c7bec16c-cb31-4a07-94f9-f4ac0f138bf2,2025-07-15 23:26:31,2025-07-16,"The handlebars on my rental bike are loose and keep shifting while I'm riding, it's pretty annoying. I've tried to tighten them but it doesn't seem to be making a difference. I'd appreciate it if someone could take a look and fix the issue so I can finish my ride safely."
09e1a60f-83de-4e6a-979b-e3fc4f4a528b,76a4582f-a53b-4397-a127-acaa9362f9ce,2025-07-15 19:58:17,2025-07-19,
5e3b71f0-26fb-444d-baa9-8d1ca290ade7,16d712cc-12a5-4c5f-9e35-a0ddc71f7938,2025-07-15 02:54:25,2025-07-18,Broken
e7b58d82-1e37-42ab-8fd5-ff569cbb0d8f,88362d61-8dcf-4282-b7b5-afdb1069772f,2025-07-15 21:28:11,2025-07-16,"The brakes on my rental bike are not working properly, it's taking a lot of effort to slow down and stop. I'm having to squeeze the brake levers really hard to get any response, which is kinda scary. I'd appreciate it if someone could take a look and fix the issue ASAP."
3ae92daf-fb11-4c56-ad77-bfb71fc4fe7d,df3e9361-b33e-4053-a21f-653fbc4b4358,2025-07-15 23:20:46,2025-07-19,"The seat on my rental bike is loose and keeps sliding back and forth, making it hard to ride. I've tried to tighten it, but it doesn't seem to be staying in place. Can I get a replacement or have this one fixed ASAP?"
