maintenance_id,bike_id,reported_time,resolved_time,issue_description
c0ee9347-ea09-48de-b02d-3c1e43f477d6,1dbe235a-8f31-4169-971f-8fd7ef97a218,2025-08-23 11:15:23,2025-08-25,"The brakes on my rental bike are not working properly, it's taking a lot of effort to slow down and stop. I'm having to squeeze the brake levers really hard to get any response, which is kinda scary. I'd appreciate it if someone could take a look and fix the issue ASAP."
dbee5e9b-e619-42ea-ac98-1b3eb97b6ee7,c4cf677d-a21b-45cf-829b-79ff387c72f7,2025-08-23 16:59:40,2025-08-26,"The chain on my rental bike keeps slipping off the gears, making it hard to pedal. I've tried adjusting it, but it doesn't seem to be staying in place. I'd appreciate it if someone could take a look and fix the issue so I can continue my ride."
748dbbaa-d84e-4f9d-8c29-0f72a844f41e,5aa7f347-befa-4f59-ab26-33da98521fe4,2025-08-23 06:12:12,2025-08-24,"The tires on my rental bike are low on air and one of them has a slow leak, making it difficult to ride. I've only had the bike for an hour and I'm already having to stop frequently to add air. I'd appreciate it if someone could take a look at it and fix the issue as soon as possible."
b5d02ff4-efe9-4b04-9745-20f119857cdd,3b7ceca2-db08-4d72-bdc5-434c927ee081,2025-08-23 20:28:20,2025-08-25,"The safety reflectors on my rental bike are loose and not securely attached, which is a safety concern. I noticed the issue as soon as I started riding and I'm worried it could cause problems, especially at night. I'd appreciate it if someone could take a look and fix the reflectors as soon as possible."
22335215-ab43-4a1e-9248-c14d74d7fab9,e5d96706-a7c2-43e8-80b5-010493b6c9ea,2025-08-23 02:37:54,2025-08-24,"The chain on my rental bike keeps slipping off the gears, making it hard to pedal. I've tried adjusting it, but it doesn't seem to be staying in place. I'd appreciate it if someone could take a look and fix the issue so I can continue my ride."
6d7d3a90-0c77-4d8f-9132-409105b59706,02605cc2-c123-44fd-9b9f-aaf156ce1ed0,2025-08-23 12:36:52,2025-08-28,"The safety reflectors on my rental bike are loose and not securely attached, which is a safety concern. I noticed the issue as soon as I started riding and I'm worried it could cause problems, especially at night. I'd appreciate it if someone could take a look and fix the reflectors as soon as possible."
5be5a343-a737-4d29-b0b4-9cd78326111b,061496fd-b988-4d23-b439-8f931fefe7d6,2025-08-23 16:20:31,2025-08-26,"The seat on my rental bike is loose and keeps sliding back and forth, making it hard to ride. I've tried to tighten it, but it doesn't seem to be staying in place. Can I get a replacement or have this one fixed ASAP?"
b989809b-815b-46f8-8aee-e760bb327663,14330e95-3e0a-4ed0-9234-f8bafcf62e77,2025-08-23 07:32:39,2025-08-28,"The brakes on my rental bike are not working properly, it's taking a lot of effort to slow down and stop. I'm having to squeeze the brake levers really hard to get any response, which is kinda scary. I'd appreciate it if someone could take a look and fix the issue ASAP."
