maintenance_id,bike_id,reported_time,resolved_time,issue_description
3f47f4d4-671d-4855-a899-84d0f804e0d0,1f1514c4-e48a-47c1-bfd3-b2bfec408657,2025-06-16 08:45:55,2025-06-19,"The handlebars on my rental bike are loose and keep shifting while I'm riding, it's pretty annoying. I've tried to tighten them but it doesn't seem to be making a difference. I'd appreciate it if someone could take a look and fix the issue so I can finish my ride safely."
b88d1d66-d768-4f81-902c-ad5db4395ba0,6444be5a-6888-4a3e-a8e3-e9f87d2140b6,2025-06-16 02:19:44,2025-06-19,"The chain on my rental bike keeps slipping off the gears, making it hard to pedal. I've tried adjusting it, but it doesn't seem to be staying in place. I'd appreciate it if someone could take a look and fix the issue so I can continue my ride."
c94984f7-b38c-4735-853d-4fbdfbdb657d,e3329d13-373c-4d02-ad7e-7b071dc092c2,2025-06-16 13:06:28,2025-06-17,"The safety reflectors on my rental bike are loose and not securely attached, which is a safety concern. I noticed the issue as soon as I started riding and I'm worried it could cause problems, especially at night. I'd appreciate it if someone could take a look and fix the reflectors as soon as possible."
7d519943-f0e8-4352-9b70-71e4e8bf2aca,76e8423a-2fd3-4219-b029-5a2c0f74e88e,2025-06-16 07:33:08,2025-06-21,"The brakes on my rental bike are not working properly, it's taking a lot of effort to slow down and stop. I'm having to squeeze the brake levers really hard to get any response, which is kinda scary. I'd appreciate it if someone could take a look and fix the issue ASAP."
fc4d1565-ab92-44e8-903c-d8eee17c568a,f821cebd-3d91-4c28-8d70-553579fc371a,2025-06-16 13:02:24,2025-06-20,"The tires on my rental bike are low on air and one of them has a slow leak, making it difficult to ride. I've only had the bike for an hour and I'm already having to stop frequently to add air. I'd appreciate it if someone could take a look at it and fix the issue as soon as possible."
8465251f-e6fd-4cc9-8bf0-cc401937c47f,e88d73d0-3858-425d-b878-37545e4c6a18,2025-06-16 07:15:10,2025-06-20,"The handlebars on my rental bike are loose and keep shifting while I'm riding, it's pretty annoying. I've tried to tighten them but it doesn't seem to be making a difference. I'd appreciate it if someone could take a look and fix the issue so I can finish my ride safely."
