maintenance_id,bike_id,reported_time,resolved_time,issue_description
770368e2-ad48-4f31-9ea7-241d1f0e586c,9131d2c5-90d6-48f6-a081-84d56ba1fc90,2025-07-02 22:12:37,2025-07-03,"The chain on my rental bike keeps slipping off the gears, making it hard to pedal. I've tried adjusting it, but it doesn't seem to be staying in place. I'd appreciate it if someone could take a look and fix the issue so I can continue my ride."
7124c66d-21b5-46d5-b937-572a422c0cfd,474bf6ce-a92c-4c49-8b2e-44a6ac6bca2e,2025-07-02 19:03:04,2025-07-07,"The brakes on my rental bike are not working properly, it's taking a lot of effort to slow down and stop. I'm having to squeeze the brake levers really hard to get any response, which is kinda scary. I'd appreciate it if someone could take a look and fix the issue ASAP."
50b133ad-a0de-4072-ae57-f61f7fbdb709,312336ef-c293-43b5-9644-23aea215ae81,2025-07-02 03:55:08,2025-07-04,"The seat on my rental bike is loose and keeps sliding back and forth, making it hard to ride. I've tried to tighten it, but it doesn't seem to be staying in place. Can I get a replacement or have this one fixed ASAP?"
d9d964f5-16c5-4582-b018-af228f1df76b,de21cf20-38ed-4023-a851-8644b6a318f2,2025-07-02 08:38:08,2025-07-05,"The chain on my rental bike keeps slipping off the gears, making it hard to pedal. I've tried adjusting it, but it doesn't seem to be staying in place. I'd appreciate it if someone could take a look and fix the issue so I can continue my ride."
f3f7faf0-b922-4151-8ab3-0542d01fe198,e28e7c63-05aa-4ea0-9030-f71f1bc3e6d4,2025-07-02 23:38:10,2025-07-03,"The safety reflectors on my rental bike are loose and not securely attached, which is a safety concern. I noticed the issue as soon as I started riding and I'm worried it could cause problems, especially at night. I'd appreciate it if someone could take a look and fix the reflectors as soon as possible."
