maintenance_id,bike_id,reported_time,resolved_time,issue_description
c915731e-75a4-4a76-a42e-037159834942,26354a04-099a-423a-9b26-5c91ad1e3525,2025-07-17 04:11:10,2025-07-21,"The seat on my rental bike is loose and keeps sliding back and forth, making it hard to ride. I've tried to tighten it, but it doesn't seem to be staying in place. Can I get a replacement or have this one fixed ASAP?"
707f53d2-ea58-4207-a310-dd71c0e3975e,4b5ea3dd-1436-4284-abfc-a7f3c69ed514,2025-07-17 17:46:58,2025-07-19,
9b67233b-fbae-4c24-a28c-22bdfd31ec67,de21cf20-38ed-4023-a851-8644b6a318f2,2025-07-17 14:56:15,2025-07-20,"The chain on my rental bike keeps slipping off the gears, making it hard to pedal. I've tried adjusting it, but it doesn't seem to be staying in place. I'd appreciate it if someone could take a look and fix the issue so I can continue my ride."
842c0947-4ee2-4527-9723-ef44d808ba5e,297dfa8a-bc80-4c12-ab93-229d466863c6,2025-07-17 13:45:41,2025-07-18,
8b313022-f188-4f1c-bd7d-86040c1e6b1f,d6ce88de-42ee-47e9-a3a3-f9de4700745a,2025-07-17 18:48:30,2025-07-20,"The brakes on my rental bike are not working properly, it's taking a lot of effort to slow down and stop. I'm having to squeeze the brake levers really hard to get any response, which is kinda scary. I'd appreciate it if someone could take a look and fix the issue ASAP."
